{
  "$schema": "../../schema/view-props.schema.json",
  "version": "1.0.0-rc.3",
  "section": "pricing",
  "data": [
    {
      "name": "eyebrow",
      "kind": "text",
      "nullable": true,
      "from": "field",
      "field": "eyebrow"
    },
    {
      "name": "heading",
      "kind": "text",
      "nullable": true,
      "from": "field",
      "field": "heading"
    },
    {
      "name": "plans",
      "kind": "list",
      "of": "pricing-plan",
      "from": "field",
      "field": "plans"
    }
  ],
  "types": {
    "pricing-plan": {
      "props": [
        {
          "name": "name",
          "kind": "text",
          "from": "logic",
          "field": "plans.name",
          "description": "Never null: the logic drops a plan whose name cleans away (SC-009); with none left, the section draws nothing."
        },
        {
          "name": "price",
          "kind": "text",
          "nullable": true,
          "from": "field",
          "field": "plans.price"
        },
        {
          "name": "period",
          "kind": "text",
          "nullable": true,
          "from": "field",
          "field": "plans.period"
        },
        {
          "name": "features",
          "kind": "list",
          "of": "plan-feature",
          "from": "field",
          "field": "plans.features"
        },
        {
          "name": "cta",
          "kind": "object",
          "of": "link",
          "nullable": true,
          "from": "field",
          "field": "plans.cta"
        },
        {
          "name": "featured",
          "kind": "boolean",
          "from": "field",
          "field": "plans.featured"
        }
      ]
    },
    "plan-feature": {
      "props": [
        {
          "name": "text",
          "kind": "text",
          "from": "logic",
          "field": "plans.features.text",
          "description": "Never null: the logic drops a feature line whose text cleans away (SC-009)."
        },
        {
          "name": "included",
          "kind": "boolean",
          "from": "field",
          "field": "plans.features.included"
        }
      ]
    }
  },
  "platforms": {
    "nextjs": {
      "note": "An edge recipe on both platforms (SC-006); a recipe that offers it takes these props."
    },
    "wordpress": {
      "owes": "a view template that takes these props, split from the section's logic"
    }
  }
}
