{
  "$schema": "../../schema/view-props.schema.json",
  "version": "1.0.0-rc.3",
  "section": "tabs",
  "data": [
    {
      "name": "eyebrow",
      "kind": "text",
      "nullable": true,
      "from": "field",
      "field": "eyebrow"
    },
    {
      "name": "heading",
      "kind": "text",
      "nullable": true,
      "from": "field",
      "field": "heading"
    },
    {
      "name": "intro",
      "kind": "text",
      "nullable": true,
      "from": "field",
      "field": "intro"
    },
    {
      "name": "label",
      "kind": "text",
      "nullable": true,
      "from": "field",
      "field": "label",
      "description": "The field as set; with no heading, it names the set (from:heading or label)."
    },
    {
      "name": "named",
      "kind": "boolean",
      "description": "True when the heading or the label is set. Without a name the markup draws the panels stacked, with no radio group, so a swapped view sees the same case core does.",
      "from": "logic"
    },
    {
      "name": "tabs",
      "kind": "list",
      "of": "tab",
      "from": "field",
      "field": "tabs"
    }
  ],
  "types": {
    "tab": {
      "props": [
        {
          "name": "id",
          "kind": "text",
          "description": "Stable per tab, for <anchor>__tab-<n> and its panel.",
          "from": "logic"
        },
        {
          "name": "label",
          "kind": "text",
          "from": "logic",
          "field": "tabs.label",
          "description": "Never null: the logic drops a tab whose label cleans away (SC-009) or does not resolve, as Salt for Next.js's resolver does."
        },
        {
          "name": "content",
          "kind": "rich-text",
          "from": "logic",
          "field": "tabs.content",
          "description": "Never null: the logic drops a tab whose content cleans away (SC-009) or does not resolve, as Salt for Next.js's resolver does."
        }
      ]
    }
  },
  "platforms": {
    "nextjs": {
      "formerly": "TabsBlockData",
      "owes": "named"
    },
    "wordpress": {
      "owes": "a view template that takes these props, split from the section's logic"
    }
  }
}
