{
  "$schema": "../../schema/view-props.schema.json",
  "version": "1.0.0-rc.2",
  "section": "logos",
  "data": [
    {
      "name": "heading",
      "kind": "text",
      "nullable": true,
      "from": "field",
      "field": "heading"
    },
    {
      "name": "intro",
      "kind": "text",
      "nullable": true,
      "from": "field",
      "field": "intro"
    },
    {
      "name": "columns",
      "kind": "enum",
      "values": [
        "2",
        "3",
        "4"
      ],
      "from": "field",
      "field": "columns"
    },
    {
      "name": "greyscale",
      "kind": "boolean",
      "from": "field",
      "field": "greyscale"
    },
    {
      "name": "items",
      "kind": "list",
      "of": "logo",
      "from": "field",
      "field": "items"
    }
  ],
  "types": {
    "logo": {
      "props": [
        {
          "name": "image",
          "kind": "object",
          "of": "image",
          "from": "logic",
          "field": "items.image",
          "description": "Never null: the logic drops a logo whose image does not resolve (a deleted upload), as Salt for Next.js's resolver does."
        },
        {
          "name": "name",
          "kind": "text",
          "nullable": true,
          "from": "field",
          "field": "items.name"
        },
        {
          "name": "href",
          "kind": "text",
          "nullable": true,
          "from": "logic",
          "field": "items.url"
        }
      ]
    }
  },
  "platforms": {
    "nextjs": {
      "formerly": "LogosBlockData",
      "owes": "an item as {image, name, href} in place of the media fields spread beside href and linkLabel"
    },
    "wordpress": {
      "owes": "a view template that takes these props, split from the section's logic"
    }
  }
}
